18:58:15.801177 IP 192.168.3.146.51531 > 192.168.3.14.domain: 45828+ CNAME? dnscat.60d201f876f3ac26f0d131003afbac0ee3. (59)
18:58:15.802048 IP 192.168.3.14.domain > 192.168.3.146.51531: 45828 CNAME dnscat.acb201f876cc2d09230bd1ffff199bc5d2. (114)
18:58:16.197885 IP 192.168.3.14.39576 > dns.google.domain: 21832+ PTR? 13.3.168.192.in-addr.arpa. (43)
18:58:16.210500 IP dns.google.domain > 192.168.3.14.39576: 21832 NXDomain 0/0/0 (43)
18:58:16.210722 IP 192.168.3.14.34517 > dns.google.domain: 37842+ PTR? 136.3.168.192.in-addr.arpa. (44)
18:58:16.223080 IP dns.google.domain > 192.168.3.14.34517: 37842 NXDomain 0/0/0 (44)
18:58:16.805995 IP 192.168.3.146.51531 > 192.168.3.14.domain: 59536+ TXT? dnscat.511c01f87681d44363bc4f003be0953e96. (59)
18:58:16.806868 IP 192.168.3.14.domain > 192.168.3.146.51531: 59536 TXT "e7ba01f87605bc9ccecba2ffff199bc5d2" (106)
18:58:17.221417 IP 192.168.3.14.33344 > dns.google.domain: 33961+ PTR? 8.8.8.8.in-addr.arpa. (38)
18:58:17.233863 IP dns.google.domain > 192.168.3.14.33344: 33961 PTR dns.google. (62)
18:58:17.811021 IP 192.168.3.146.51531 > 192.168.3.14.domain: 8503+ MX? dnscat.841c01f876152b68c20057003c252f9020. (59)
18:58:17.811893 IP 192.168.3.14.domain > 192.168.3.146.51531: 8503 MX dnscat.a13701f87611c4c881df5affff199bc5d2. 10 (116)
18:58:18.815843 IP 192.168.3.146.51531 > 192.168.3.14.domain: 5143+ MX? dnscat.241c01f876c3b96a7ac048003d7dbd506e. (59)
18:58:18.817084 IP 192.168.3.14.domain > 192.168.3.146.51531: 5143 MX dnscat.afdb01f876ff9e46d1d674ffff199bc5d2. 10 (116)
18:58:19.821267 IP 192.168.3.146.51531 > 192.168.3.14.domain: 26524+ MX? dnscat.039301f876bdf128661580003e715cd669. (59)
18:58:19.822213 IP 192.168.3.14.domain > 192.168.3.146.51531: 26524 MX dnscat.1fd801f87694b660c20109ffff199bc5d2. 10 (116)
18:58:20.826372 IP 192.168.3.146.51531 > 192.168.3.14.domain: 33605+ TXT? dnscat.e70a01f876235811e9f736003fca49a8f9. (59)
18:58:20.827254 IP 192.168.3.14.domain > 192.168.3.146.51531: 33605 TXT "13a801f876e3830702f67fffff199bc5d2" (106)
18:58:21.831247 IP 192.168.3.146.51531 > 192.168.3.14.domain: 5218+ TXT? dnscat.cc6401f87693fd6fd72e6a00409f97a72e. (59)
18:58:21.832128 IP 192.168.3.14.domain > 192.168.3.146.51531: 5218 TXT "b88501f8769036af4a2638ffff199bc5d2" (106)
18:58:22.835938 IP 192.168.3.146.51531 > 192.168.3.14.domain: 7425+ MX? dnscat.d0c901f8760a4a272313c90041dfd900ce. (59)
18:58:22.836879 IP 192.168.3.14.domain > 192.168.3.146.51531: 7425 MX dnscat.40fb01f87693cc51b6ef2dffff199bc5d2. 10 (116)
18:58:23.840854 IP 192.168.3.146.51531 > 192.168.3.14.domain: 51611+ MX? dnscat.95f601f8762983d5956eab0042c7741cd6. (59)
18:58:23.841808 IP 192.168.3.14.domain > 192.168.3.146.51531: 51611 MX dnscat.904801f87660dd83dc9b62ffff199bc5d2. 10 (116)
18:58:24.845818 IP 192.168.3.146.51531 > 192.168.3.14.domain: 46841+ CNAME? dnscat.ecc601f8764462081971950043199bfaf3. (59)
18:58:24.847087 IP 192.168.3.14.domain > 192.168.3.146.51531: 46841 CNAME dnscat.23dd01f876ed4afd1a6a65ffff199bc5d2. (114)
18:58:25.851045 IP 192.168.3.146.51531 > 192.168.3.14.domain: 61845+ MX? dnscat.4cd201f8765c66ebef80d9004440289484. (59)
18:58:25.851897 IP 192.168.3.14.domain > 192.168.3.146.51531: 61845 MX dnscat.a71501f8763bcbc4291b1bffff199bc5d2. 10 (116)
18:58:26.856035 IP 192.168.3.146.51531 > 192.168.3.14.domain: 62194+ MX? dnscat.b07b01f87665447abc7ab100457d7cb1e7. (59)
18:58:26.856996 IP 192.168.3.14.domain > 192.168.3.146.51531: 62194 MX dnscat.510901f876152866d016edffff199bc5d2. 10 (116)
18:58:27.861150 IP 192.168.3.146.51531 > 192.168.3.14.domain: 15087+ TXT? dnscat.f15b01f87633b7c8f064f5004643e565f3. (59)
18:58:27.861937 IP 192.168.3.14.domain > 192.168.3.146.51531: 15087 TXT "3a5501f876634897648dfdffff199bc5d2" (106)
18:58:28.865837 IP 192.168.3.146.51531 > 192.168.3.14.domain: 63877+ TXT? dnscat.bba301f8764398f46ba05b00475537c0b6. (59)
18:58:28.866627 IP 192.168.3.14.domain > 192.168.3.146.51531: 63877 TXT "c7d201f87697490ed0bbf0ffff199bc5d2" (106)
18:58:29.870608 IP 192.168.3.146.51531 > 192.168.3.14.domain: 35423+ CNAME? dnscat.dd9801f876fd8dd5c03e880048d4e9b18b. (59)
18:58:29.871434 IP 192.168.3.14.domain > 192.168.3.146.51531: 35423 CNAME dnscat.2a6101f87686f99410162fffff199bc5d2. (114)
18:58:30.875396 IP 192.168.3.146.51531 > 192.168.3.14.domain: 11685+ MX? dnscat.289601f876166cdce16a480049e998d619. (59)
18:58:30.875690 IP 192.168.3.14.domain > 192.168.3.146.51531: 11685 MX dnscat.9ee301f8768e5aeba99ff0ffff199bc5d2. 10 (116)
18:58:31.879570 IP 192.168.3.146.51531 > 192.168.3.14.domain: 49211+ MX? dnscat.26e101f8764feb8481ea46004ae58ac37b. (59)
18:58:31.880462 IP 192.168.3.14.domain > 192.168.3.146.51531: 49211 MX dnscat.1b3401f876625213981fe2ffff199bc5d2. 10 (116)
18:58:32.884243 IP 192.168.3.146.51531 > 192.168.3.14.domain: 21255+ CNAME? dnscat.872a01f876aff23f1572df004b3d1b3381. (59)
18:58:32.884858 IP 192.168.3.14.domain > 192.168.3.146.51531: 21255 CNAME dnscat.055801f876db129e6e86a5ffff199bc5d2. (114)
18:58:33.888996 IP 192.168.3.146.51531 > 192.168.3.14.domain: 40224+ MX? dnscat.f90201f8762509ea93bf59004c0e8e9dd6. (59)
18:58:33.889839 IP 192.168.3.14.domain > 192.168.3.146.51531: 40224 MX dnscat.fc2301f8768955218d772bffff199bc5d2. 10 (116)
18:58:34.893808 IP 192.168.3.146.51531 > 192.168.3.14.domain: 2649+ CNAME? dnscat.df7301f8766c44560acd36004d30b61a13. (59)
18:58:34.894651 IP 192.168.3.14.domain > 192.168.3.146.51531: 2649 CNAME dnscat.7bd101f876620066ad9c77ffff199bc5d2. (114)
18:58:35.898602 IP 192.168.3.146.51531 > 192.168.3.14.domain: 21875+ CNAME? dnscat.ee2e01f876a6481b28924b004ea4e4dcbf. (59)
18:58:35.899447 IP 192.168.3.14.domain > 192.168.3.146.51531: 21875 CNAME dnscat.cf2401f87694af8e07e000ffff199bc5d2. (114)
18:58:36.903478 IP 192.168.3.146.51531 > 192.168.3.14.domain: 58170+ CNAME? dnscat.26ad01f876bd057ac14aff004f2e739250. (59)
18:58:36.903776 IP 192.168.3.14.domain > 192.168.3.146.51531: 58170 CNAME dnscat.b72401f8768e7494055c71ffff199bc5d2. (114)
18:58:37.907752 IP 192.168.3.146.51531 > 192.168.3.14.domain: 35194+ MX? dnscat.b6e601f876fea18312b1880050513d8615. (59)
18:58:37.908602 IP 192.168.3.14.domain > 192.168.3.146.51531: 35194 MX dnscat.dc8001f876ef0ef85de5daffff199bc5d2. 10 (116)
18:58:38.912564 IP 192.168.3.146.51531 > 192.168.3.14.domain: 61538+ MX? dnscat.579601f8763892c55d9fa7005195675c43. (59)
18:58:38.912967 IP 192.168.3.14.domain > 192.168.3.146.51531: 61538 MX dnscat.acb201f876cc2d09230bd1ffff199bc5d2. 10 (116)
18:58:39.917092 IP 192.168.3.146.51531 > 192.168.3.14.domain: 21961+ MX? dnscat.7b9c01f876aaab66df2c210052137fc4a1. (59)
18:58:39.917954 IP 192.168.3.14.domain > 192.168.3.146.51531: 21961 MX dnscat.00e201f876588b1d933529ffff199bc5d2. 10 (116)
18:58:40.922121 IP 192.168.3.146.51531 > 192.168.3.14.domain: 8272+ CNAME? dnscat.bd6501f876d54eeb4ed731005374d99897. (59)
18:58:40.923024 IP 192.168.3.14.domain > 192.168.3.146.51531: 8272 CNAME dnscat.208a01f876580779013311ffff199bc5d2. (114)
18:58:41.926992 IP 192.168.3.146.51531 > 192.168.3.14.domain: 13208+ MX? dnscat.b26d01f8768579c94bf0ba0054b2bd0b2a. (59)
18:58:41.927899 IP 192.168.3.14.domain > 192.168.3.146.51531: 13208 MX dnscat.545401f87625ae2ee66756ffff199bc5d2. 10 (116)
18:58:42.932077 IP 192.168.3.146.51531 > 192.168.3.14.domain: 38783+ MX? dnscat.81bc01f876899403e64c6f0055644e0911. (59)
18:58:42.933072 IP 192.168.3.14.domain > 192.168.3.146.51531: 38783 MX dnscat.3b2b01f87601df1f86970effff199bc5d2. 10 (116)
18:58:43.937040 IP 192.168.3.146.51531 > 192.168.3.14.domain: 26527+ MX? dnscat.77ce01f876a148930eb6d6005685628287. (59)
18:58:43.937907 IP 192.168.3.14.domain > 192.168.3.146.51531: 26527 MX dnscat.c80901f8769a609b19181cffff199bc5d2. 10 (116)
18:58:44.942088 IP 192.168.3.146.51531 > 192.168.3.14.domain: 13987+ MX? dnscat.448001f876f1e0350ea8b800572d2b558f. (59)
18:58:44.943326 IP 192.168.3.14.domain > 192.168.3.146.51531: 13987 MX dnscat.b3b401f87644d8df2dbf8effff199bc5d2. 10 (116)
18:58:45.947097 IP 192.168.3.146.51531 > 192.168.3.14.domain: 7347+ TXT? dnscat.bac901f876f93ed5395b930058c45989ab. (59)
18:58:45.948017 IP 192.168.3.14.domain > 192.168.3.146.51531: 7347 TXT "17fb01f87603087df95445ffff199bc5d2" (106)
18:58:46.951959 IP 192.168.3.146.51531 > 192.168.3.14.domain: 52435+ TXT? dnscat.3b7d01f8766a5d6f15193100592a68d9e5. (59)
18:58:46.952749 IP 192.168.3.14.domain > 192.168.3.146.51531: 52435 TXT "fdec01f8761eda8ff93debffff199bc5d2" (106)
18:58:47.956692 IP 192.168.3.146.51531 > 192.168.3.14.domain: 12181+ CNAME? dnscat.97b601f876c3c0f610714c005a66eac4e7. (59)
18:58:47.957647 IP 192.168.3.14.domain > 192.168.3.146.51531: 12181 CNAME dnscat.e84c01f876cf523f83baeaffff199bc5d2. (114)
18:58:48.961604 IP 192.168.3.146.51531 > 192.168.3.14.domain: 26159+ CNAME? dnscat.539401f876a5f231f49b94005bdc7795f5. (59)
18:58:48.962501 IP 192.168.3.14.domain > 192.168.3.146.51531: 26159 CNAME dnscat.7e5901f876534dbb6916d9ffff199bc5d2. (114)
18:58:49.966457 IP 192.168.3.146.51531 > 192.168.3.14.domain: 33976+ TXT? dnscat.133101f8762c70c65b6cc9005c0db54eb1. (59)
18:58:49.967287 IP 192.168.3.14.domain > 192.168.3.146.51531: 33976 TXT "f34001f8768a88fd8f7bbfffff199bc5d2" (106)
18:58:50.971465 IP 192.168.3.146.51531 > 192.168.3.14.domain: 62158+ CNAME? dnscat.da1e01f876d807cbdd403a005d3fd5e891. (59)
18:58:50.972413 IP 192.168.3.14.domain > 192.168.3.146.51531: 62158 CNAME dnscat.6a5f01f876175670e30f42ffff199bc5d2. (114)
18:58:51.976549 IP 192.168.3.146.51531 > 192.168.3.14.domain: 13237+ MX? dnscat.8f6a01f876872bbb0d0a9d005eea455569. (59)
18:58:51.977490 IP 192.168.3.14.domain > 192.168.3.146.51531: 13237 MX dnscat.cb2101f876664f41598233ffff199bc5d2. 10 (116)
18:58:52.981631 IP 192.168.3.146.51531 > 192.168.3.14.domain: 23504+ TXT? dnscat.7f7701f8764a8e11bf4533005f99139107. (59)
18:58:52.982705 IP 192.168.3.14.domain > 192.168.3.146.51531: 23504 TXT "bbe301f8769675cabb1b5fffff199bc5d2" (106)
18:58:53.986867 IP 192.168.3.146.51531 > 192.168.3.14.domain: 34848+ TXT? dnscat.fb1001f8763cc31d86a2f60060b76da714. (59)
18:58:53.987743 IP 192.168.3.14.domain > 192.168.3.146.51531: 34848 TXT "107901f87628e611690ec1ffff199bc5d2" (106)
18:58:54.991902 IP 192.168.3.146.51531 > 192.168.3.14.domain: 33344+ TXT? dnscat.182c01f87667e9a6d0f715006164292508. (59)
18:58:54.992869 IP 192.168.3.14.domain > 192.168.3.146.51531: 33344 TXT "c35201f87632096b2617d2ffff199bc5d2" (106)
18:58:55.996996 IP 192.168.3.146.51531 > 192.168.3.14.domain: 297+ TXT? dnscat.c39001f8768ee079bd4bb80062c145ecc4. (59)
18:58:55.997855 IP 192.168.3.14.domain > 192.168.3.146.51531: 297 TXT "933801f876be20b1b67e83ffff199bc5d2" (106)
18:58:57.001929 IP 192.168.3.146.51531 > 192.168.3.14.domain: 63088+ MX? dnscat.4a1001f8769c77c0f58e190063021e91e2. (59)
18:58:57.002812 IP 192.168.3.14.domain > 192.168.3.146.51531: 63088 MX dnscat.e37701f876c1802325837cffff199bc5d2. 10 (116)
18:58:58.006836 IP 192.168.3.146.51531 > 192.168.3.14.domain: 21767+ MX? dnscat.dc2701f876b1736fc872540064bf5e9040. (59)
18:58:58.007711 IP 192.168.3.14.domain > 192.168.3.146.51531: 21767 MX dnscat.a13e01f87660104adad9beffff199bc5d2. 10 (116)
18:58:59.011437 IP 192.168.3.146.51531 > 192.168.3.14.domain: 22494+ TXT? dnscat.6b3101f876ef2510906b690065755edece. (59)
18:58:59.012298 IP 192.168.3.14.domain > 192.168.3.146.51531: 22494 TXT "3dcf01f876b7aaffdb1b02ffff199bc5d2" (106)
18:59:00.016197 IP 192.168.3.146.51531 > 192.168.3.14.domain: 63610+ MX? dnscat.32d101f8760ee0c5e744260066aaf44697. (59)
18:59:00.017433 IP 192.168.3.14.domain > 192.168.3.146.51531: 63610 MX dnscat.78d001f8760719ed09bdb3ffff199bc5d2. 10 (116)
18:59:01.021528 IP 192.168.3.146.51531 > 192.168.3.14.domain: 49467+ MX? dnscat.90a001f8767da28101d4940067c9e281c7. (59)
18:59:01.022407 IP 192.168.3.14.domain > 192.168.3.146.51531: 49467 MX dnscat.743c01f8760a0b5c55b46dffff199bc5d2. 10 (116)
18:59:02.026457 IP 192.168.3.146.51531 > 192.168.3.14.domain: 57285+ CNAME? dnscat.ad3401f8768ee1a20c51f6006816076e87. (59)
18:59:02.027388 IP 192.168.3.14.domain > 192.168.3.146.51531: 57285 CNAME dnscat.f69f01f8765455cbbc0b1affff199bc5d2. (114)
18:59:03.031369 IP 192.168.3.146.51531 > 192.168.3.14.domain: 5205+ TXT? dnscat.2f7001f876d62d21e5be1d006997248c59. (59)
18:59:03.032230 IP 192.168.3.14.domain > 192.168.3.146.51531: 5205 TXT "07ca01f876b5bbf1042581ffff199bc5d2" (106)
18:59:04.036312 IP 192.168.3.146.51531 > 192.168.3.14.domain: 45553+ TXT? dnscat.1e7c01f876a6c9f69b1e81006af3bd16f8. (59)
18:59:04.037237 IP 192.168.3.14.domain > 192.168.3.146.51531: 45553 TXT "421d01f876e62f17794792ffff199bc5d2" (106)
18:59:05.041241 IP 192.168.3.146.51531 > 192.168.3.14.domain: 21945+ MX? dnscat.735b01f8762ba21fdb7e0c006bcf3cfd6a. (59)
18:59:05.042118 IP 192.168.3.14.domain > 192.168.3.146.51531: 21945 MX dnscat.511401f87634f7f6ea5960ffff199bc5d2. 10 (116)
18:59:06.046274 IP 192.168.3.146.51531 > 192.168.3.14.domain: 2567+ MX? dnscat.0d8401f87618ae33f6d1c1006cfda71411. (59)
18:59:06.047220 IP 192.168.3.14.domain > 192.168.3.146.51531: 2567 MX dnscat.7f6801f876bfd96d480719ffff199bc5d2. 10 (116)
18:59:07.051353 IP 192.168.3.146.51531 > 192.168.3.14.domain: 9294+ TXT? dnscat.db2201f87696d313d70eb9006d8311bece. (59)
18:59:07.052244 IP 192.168.3.14.domain > 192.168.3.146.51531: 9294 TXT "4d9301f876feea0c8ed171ffff199bc5d2" (106)
18:59:08.056296 IP 192.168.3.146.51531 > 192.168.3.14.domain: 34759+ TXT? dnscat.82e601f8761f741062fac4006e8ae66f14. (59)
18:59:08.057859 IP 192.168.3.14.domain > 192.168.3.146.51531: 34759 TXT "bf4a01f876a676f29dc508ffff199bc5d2" (106)
18:59:08.675528 IP 192.168.3.14.36996 > dns.google.domain: 25903+ A? connectivity-check.ubuntu.com. (47)
18:59:08.675538 IP 192.168.3.14.36996 > dns.google.domain: 49444+ AAAA? connectivity-check.ubuntu.com. (47)
18:59:08.688639 IP dns.google.domain > 192.168.3.14.36996: 49444 AAAA 2001:67c:1562::24, AAAA 2620:2d:4000:1::23, AAAA 2620:2d:4000:1::2b, AAAA 2620:2d:4000:1::2a, AAAA 2620:2d:4000:1::22, AAAA 2001:67c:1562::23 (215)
18:59:08.688671 IP dns.google.domain > 192.168.3.14.36996: 25903 A 35.232.111.17, A 185.125.190.18, A 185.125.190.49, A 185.125.190.48, A 185.125.190.17, A 35.224.170.84, A 91.189.91.49, A 34.122.121.32, A 91.189.91.48 (191)
18:59:09.061961 IP 192.168.3.146.51531 > 192.168.3.14.domain: 48621+ MX? dnscat.3bb501f876db32d4bace42006fc6bc7584. (59)
18:59:09.062896 IP 192.168.3.14.domain > 192.168.3.146.51531: 48621 MX dnscat.450301f8763fee71adcbd8ffff199bc5d2. 10 (116)
18:59:10.067031 IP 192.168.3.146.51531 > 192.168.3.14.domain: 46882+ MX? dnscat.5d2501f876885c3d4848dc00702bfb43c0. (59)
18:59:10.067973 IP 192.168.3.14.domain > 192.168.3.146.51531: 46882 MX dnscat.784401f8764d8f21962ad4ffff199bc5d2. 10 (116)
18:59:11.072130 IP 192.168.3.146.51531 > 192.168.3.14.domain: 51505+ CNAME? dnscat.e2d301f87605336b572c5300714f33dffd. (59)
18:59:11.073052 IP 192.168.3.14.domain > 192.168.3.146.51531: 51505 CNAME dnscat.d91b01f876b0228d428c39ffff199bc5d2. (114)
18:59:12.077226 IP 192.168.3.146.51531 > 192.168.3.14.domain: 5224+ MX? dnscat.8a2501f876fe5eae4c9b6500725446c253. (59)
18:59:12.078123 IP 192.168.3.14.domain > 192.168.3.146.51531: 5224 MX dnscat.1ab101f87627b6e1a956ceffff199bc5d2. 10 (116)
18:59:13.082103 IP 192.168.3.146.51531 > 192.168.3.14.domain: 52321+ TXT? dnscat.058901f8766ad41051e68100735e8861be. (59)
18:59:13.082990 IP 192.168.3.14.domain > 192.168.3.146.51531: 52321 TXT "cad101f8762f855119391bffff199bc5d2" (106)
18:59:14.086970 IP 192.168.3.146.51531 > 192.168.3.14.domain: 34971+ TXT? dnscat.56b901f8768dcd845233910074e1ffd129. (59)
18:59:14.087894 IP 192.168.3.14.domain > 192.168.3.146.51531: 34971 TXT "725201f876090f154598e3ffff199bc5d2" (106)
18:59:15.091899 IP 192.168.3.146.51531 > 192.168.3.14.domain: 45238+ TXT? dnscat.f58501f8768b562dc9c94300757f250712. (59)
18:59:15.093188 IP 192.168.3.14.domain > 192.168.3.146.51531: 45238 TXT "679c01f876f7415688eed2ffff199bc5d2" (106)
18:59:16.096991 IP 192.168.3.146.51531 > 192.168.3.14.domain: 31572+ MX? dnscat.266d01f876de2d8dcd81f6007688238a75. (59)
18:59:16.098034 IP 192.168.3.14.domain > 192.168.3.146.51531: 31572 MX dnscat.380601f876ef1b91e9ab83ffff199bc5d2. 10 (116)
18:59:17.102217 IP 192.168.3.146.51531 > 192.168.3.14.domain: 1320+ TXT? dnscat.a43a01f8769c61420e528b007715e81f5f. (59)
18:59:17.103101 IP 192.168.3.14.domain > 192.168.3.146.51531: 1320 TXT "85fd01f876f8ac8d97dce4ffff199bc5d2" (106)
18:59:18.107057 IP 192.168.3.146.51531 > 192.168.3.14.domain: 6919+ TXT? dnscat.aa6801f8768b600b41bdaf0078dfb37561. (59)
18:59:18.107880 IP 192.168.3.14.domain > 192.168.3.146.51531: 6919 TXT "2c1901f876efb43b068656ffff199bc5d2" (106)
18:59:19.111866 IP 192.168.3.146.51531 > 192.168.3.14.domain: 60548+ TXT? dnscat.50b001f876613161c4866500798b19332e. (59)
18:59:19.112749 IP 192.168.3.14.domain > 192.168.3.146.51531: 60548 TXT "e79901f8766e792bab7f88ffff199bc5d2" (106)
18:59:20.116924 IP 192.168.3.146.51531 > 192.168.3.14.domain: 57296+ TXT? dnscat.eaa401f876e7093e3766b1007a76cd68a9. (59)
18:59:20.117816 IP 192.168.3.14.domain > 192.168.3.146.51531: 57296 TXT "59b701f8766ca7e86e61a1ffff199bc5d2" (106)
18:59:21.121959 IP 192.168.3.146.51531 > 192.168.3.14.domain: 31138+ MX? dnscat.0b7701f876864f67505987007bb4468eac. (59)
18:59:21.122844 IP 192.168.3.14.domain > 192.168.3.146.51531: 31138 MX dnscat.7e0501f8766000318ab54affff199bc5d2. 10 (116)
18:59:22.127018 IP 192.168.3.146.51531 > 192.168.3.14.domain: 44232+ CNAME? dnscat.8d4501f876277ce0d0aeaa007c52248a4f. (59)
18:59:22.127900 IP 192.168.3.14.domain > 192.168.3.146.51531: 44232 CNAME dnscat.d90c01f876467369e77b90ffff199bc5d2. (114)
18:59:23.131827 IP 192.168.3.146.51531 > 192.168.3.14.domain: 44280+ MX? dnscat.ff7a01f876cdae65fd0da3007d49ecb61c. (59)
18:59:23.133009 IP 192.168.3.14.domain > 192.168.3.146.51531: 44280 MX dnscat.761701f8762aa2177cbe34ffff199bc5d2. 10 (116)
18:59:24.137158 IP 192.168.3.146.51531 > 192.168.3.14.domain: 54786+ CNAME? dnscat.619001f876abf8ff285981007ef44abdd6. (59)
18:59:24.138108 IP 192.168.3.14.domain > 192.168.3.146.51531: 54786 CNAME dnscat.24b401f8763b2e32b2ee79ffff199bc5d2. (114)
18:59:25.142064 IP 192.168.3.146.51531 > 192.168.3.14.domain: 45061+ CNAME? dnscat.ae9401f876909d8b17f28d007fc31baef3. (59)
18:59:25.142945 IP 192.168.3.14.domain > 192.168.3.146.51531: 45061 CNAME dnscat.a3ac01f87626446898b327ffff199bc5d2. (114)
18:59:26.147077 IP 192.168.3.146.51531 > 192.168.3.14.domain: 48449+ MX? dnscat.feb401f87616de935283d800805dc8b553. (59)
18:59:26.147951 IP 192.168.3.14.domain > 192.168.3.146.51531: 48449 MX dnscat.46aa01f876c450af98aa2bffff199bc5d2. 10 (116)
18:59:27.152282 IP 192.168.3.146.51531 > 192.168.3.14.domain: 65248+ TXT? dnscat.958201f8764218895739a200813b83d80c. (59)
18:59:27.152607 IP 192.168.3.14.domain > 192.168.3.146.51531: 65248 TXT "9f2101f876ca8b1a6e5011ffff199bc5d2" (106)
18:59:28.156705 IP 192.168.3.146.51531 > 192.168.3.14.domain: 27474+ MX? dnscat.3d0c01f876ad0c856cd07e0082a0c63bfe. (59)
18:59:28.157895 IP 192.168.3.14.domain > 192.168.3.146.51531: 27474 MX dnscat.1a7d01f876cd280327596bffff199bc5d2. 10 (116)
18:59:29.162036 IP 192.168.3.146.51531 > 192.168.3.14.domain: 22429+ MX? dnscat.d17b01f876011418173f940083d30a002a. (59)
18:59:29.162944 IP 192.168.3.14.domain > 192.168.3.146.51531: 22429 MX dnscat.bcfb01f876f4e14a5f508cffff199bc5d2. 10 (116)
18:59:30.166895 IP 192.168.3.146.51531 > 192.168.3.14.domain: 7073+ CNAME? dnscat.bdff01f8769e109727ca270084c0387a9d. (59)
18:59:30.168018 IP 192.168.3.14.domain > 192.168.3.146.51531: 7073 CNAME dnscat.730301f876ecbd31df97bdffff199bc5d2. (114)
18:59:31.172034 IP 192.168.3.146.51531 > 192.168.3.14.domain: 45016+ TXT? dnscat.356b01f8760592fcfe712100856799635f. (59)
18:59:31.172907 IP 192.168.3.14.domain > 192.168.3.146.51531: 45016 TXT "ea5d01f876a470c4793844ffff199bc5d2" (106)
18:59:32.177099 IP 192.168.3.146.51531 > 192.168.3.14.domain: 54653+ CNAME? dnscat.c85e01f876abf18554cb5400864a9ce7b6. (59)
18:59:32.177980 IP 192.168.3.14.domain > 192.168.3.146.51531: 54653 CNAME dnscat.b42e01f87633dafe88ed22ffff199bc5d2. (114)
18:59:33.182102 IP 192.168.3.146.51531 > 192.168.3.14.domain: 27734+ TXT? dnscat.a40f01f8768944c8a2a3a8008728813350. (59)
18:59:33.182927 IP 192.168.3.14.domain > 192.168.3.146.51531: 27734 TXT "03a501f876e1f4c3a99f0dffff199bc5d2" (106)
18:59:34.187114 IP 192.168.3.146.51531 > 192.168.3.14.domain: 34999+ CNAME? dnscat.f7eb01f87636a76e8230980088bc1be12c. (59)
18:59:34.187998 IP 192.168.3.14.domain > 192.168.3.146.51531: 34999 CNAME dnscat.9bd601f8768cc15d00b44dffff199bc5d2. (114)
18:59:35.191984 IP 192.168.3.146.51531 > 192.168.3.14.domain: 56465+ MX? dnscat.e26f01f87620e895e2e903008957d3d405. (59)
18:59:35.192972 IP 192.168.3.14.domain > 192.168.3.146.51531: 56465 MX dnscat.ab1f01f876d015bec638eeffff199bc5d2. 10 (116)
18:59:36.196933 IP 192.168.3.146.51531 > 192.168.3.14.domain: 48543+ MX? dnscat.56f801f876716c5acb65cf008abb49d856. (59)
18:59:36.198183 IP 192.168.3.14.domain > 192.168.3.146.51531: 48543 MX dnscat.d81b01f876c88c07939cdbffff199bc5d2. 10 (116)
18:59:37.202351 IP 192.168.3.146.51531 > 192.168.3.14.domain: 13799+ CNAME? dnscat.630701f87624b0d9c6410b008bd7aa8f8f. (59)
18:59:37.203250 IP 192.168.3.14.domain > 192.168.3.146.51531: 13799 CNAME dnscat.392801f876d07648cfbfa9ffff199bc5d2. (114)
18:59:38.207389 IP 192.168.3.146.51531 > 192.168.3.14.domain: 27063+ TXT? dnscat.e1c101f876735f91bdd20c008c1e1c74d8. (59)
18:59:38.208260 IP 192.168.3.14.domain > 192.168.3.146.51531: 27063 TXT "d66101f876f99d517411eeffff199bc5d2" (106)
18:59:39.212413 IP 192.168.3.146.51531 > 192.168.3.14.domain: 57559+ CNAME? dnscat.d60c01f8768a9e23a5c6ef008d3859eb50. (59)
18:59:39.213406 IP 192.168.3.14.domain > 192.168.3.146.51531: 57559 CNAME dnscat.710a01f87659420d3e9cb7ffff199bc5d2. (114)
18:59:40.217570 IP 192.168.3.146.51531 > 192.168.3.14.domain: 22836+ CNAME? dnscat.fb9e01f876b928cf2cdfdd008e3a9eff4a. (59)
18:59:40.218440 IP 192.168.3.14.domain > 192.168.3.146.51531: 22836 CNAME dnscat.87f501f876dd68dc040030ffff199bc5d2. (114)
18:59:41.222602 IP 192.168.3.146.51531 > 192.168.3.14.domain: 35311+ CNAME? dnscat.2f9c01f8765acb8a446a92008fb377d58c. (59)
18:59:41.223080 IP 192.168.3.14.domain > 192.168.3.146.51531: 35311 CNAME dnscat.f44701f876e921270c2b29ffff199bc5d2. (114)
18:59:42.227261 IP 192.168.3.146.51531 > 192.168.3.14.domain: 15419+ TXT? dnscat.54d901f8760636a1f9981f00902b8c3013. (59)
18:59:42.228967 IP 192.168.3.14.domain > 192.168.3.146.51531: 15419 TXT "925101f876e30816703a97ffff199bc5d2" (106)
18:59:43.233130 IP 192.168.3.146.51531 > 192.168.3.14.domain: 33919+ TXT? dnscat.757b01f87625b9cf597cf90091b4992a2e. (59)
18:59:43.233961 IP 192.168.3.14.domain > 192.168.3.146.51531: 33919 TXT "0e4f01f8766d000e70c918ffff199bc5d2" (106)
18:59:44.238109 IP 192.168.3.146.51531 > 192.168.3.14.domain: 12061+ MX? dnscat.970b01f87638195f5494360092945922f2. (59)
18:59:44.239046 IP 192.168.3.14.domain > 192.168.3.146.51531: 12061 MX dnscat.d70d01f87605e01ea7639dffff199bc5d2. 10 (116)
18:59:45.243221 IP 192.168.3.146.51531 > 192.168.3.14.domain: 50352+ CNAME? dnscat.104401f87610f72c2204bc0093493b1828. (59)
18:59:45.244102 IP 192.168.3.14.domain > 192.168.3.146.51531: 50352 CNAME dnscat.5e9c01f876d62171f46401ffff199bc5d2. (114)
18:59:46.248056 IP 192.168.3.146.51531 > 192.168.3.14.domain: 62959+ MX? dnscat.56a901f8764cadd54f804400943d8f63da. (59)
18:59:46.249230 IP 192.168.3.14.domain > 192.168.3.146.51531: 62959 MX dnscat.06e801f876c7577c454ff3ffff199bc5d2. 10 (116)
18:59:47.253179 IP 192.168.3.146.51531 > 192.168.3.14.domain: 15918+ TXT? dnscat.90aa01f8767c06d7709e8f00955dfc5589. (59)
18:59:47.254066 IP 192.168.3.14.domain > 192.168.3.146.51531: 15918 TXT "73dd01f8768b30d3995d5bffff199bc5d2" (106)
18:59:48.258158 IP 192.168.3.146.51531 > 192.168.3.14.domain: 41620+ MX? dnscat.e28101f876f2463d2e7f190096c78a0390. (59)
18:59:48.259139 IP 192.168.3.14.domain > 192.168.3.146.51531: 41620 MX dnscat.f09301f87666b9e520ff2dffff199bc5d2. 10 (116)
18:59:49.263298 IP 192.168.3.146.51531 > 192.168.3.14.domain: 15914+ MX? dnscat.769601f8761c5776572eef0097621fd0e1. (59)
18:59:49.264609 IP 192.168.3.14.domain > 192.168.3.146.51531: 15914 MX dnscat.872d01f8765f97c78ff459ffff199bc5d2. 10 (116)
18:59:50.268760 IP 192.168.3.146.51531 > 192.168.3.14.domain: 64883+ MX? dnscat.1d9a01f8760f61d19bf1ad009833642a0c. (59)
18:59:50.269723 IP 192.168.3.14.domain > 192.168.3.146.51531: 64883 MX dnscat.fdf201f87677a6296a6a89ffff199bc5d2. 10 (116)
18:59:51.273912 IP 192.168.3.146.51531 > 192.168.3.14.domain: 49215+ TXT? dnscat.423201f8767fbf8992b36e00991f93e827. (59)
18:59:51.274787 IP 192.168.3.14.domain > 192.168.3.146.51531: 49215 TXT "1b8d01f876a1016d0ee111ffff199bc5d2" (106)
18:59:52.278739 IP 192.168.3.146.51531 > 192.168.3.14.domain: 49+ TXT? dnscat.efd301f876d54ca7773b7c009acba60626. (59)
18:59:52.279657 IP 192.168.3.14.domain > 192.168.3.146.51531: 49 TXT "988701f8768734b8fc7c9effff199bc5d2" (106)
18:59:53.283823 IP 192.168.3.146.51531 > 192.168.3.14.domain: 27153+ MX? dnscat.33c401f87638db37977699009bdca95b12. (59)
18:59:53.284746 IP 192.168.3.14.domain > 192.168.3.146.51531: 27153 MX dnscat.d25f01f8767e41914b994fffff199bc5d2. 10 (116)
18:59:54.288671 IP 192.168.3.146.51531 > 192.168.3.14.domain: 43736+ CNAME? dnscat.0d8001f876ef6cbadd93b9009c7c369677. (59)
18:59:54.289541 IP 192.168.3.14.domain > 192.168.3.146.51531: 43736 CNAME dnscat.133a01f876da15dbad7ec8ffff199bc5d2. (114)
18:59:55.293868 IP 192.168.3.146.51531 > 192.168.3.14.domain: 39047+ TXT? dnscat.5e9501f8761591b5061c44009da308dcd8. (59)
18:59:55.294673 IP 192.168.3.14.domain > 192.168.3.146.51531: 39047 TXT "2e1901f8765713c2f0bf46ffff199bc5d2" (106)
18:59:56.298656 IP 192.168.3.146.51531 > 192.168.3.14.domain: 58147+ CNAME? dnscat.d59a01f876ea9bddc36423009e1cbe897a. (59)
18:59:56.299772 IP 192.168.3.14.domain > 192.168.3.146.51531: 58147 CNAME dnscat.0d7901f876977bbc42ca7dffff199bc5d2. (114)
18:59:57.303732 IP 192.168.3.146.51531 > 192.168.3.14.domain: 18415+ MX? dnscat.f14401f8761fafb72aba7c009f5ff2da2a. (59)
18:59:57.304564 IP 192.168.3.14.domain > 192.168.3.146.51531: 18415 MX dnscat.c80701f8761f036eebe558ffff199bc5d2. 10 (116)
18:59:58.308529 IP 192.168.3.146.51531 > 192.168.3.14.domain: 50634+ TXT? dnscat.471601f876a5a8e373bfb000a0eb9afba9. (59)
18:59:58.309370 IP 192.168.3.14.domain > 192.168.3.146.51531: 50634 TXT "f29101f876089dd2919598ffff199bc5d2" (106)
18:59:59.313302 IP 192.168.3.146.51531 > 192.168.3.14.domain: 51206+ TXT? dnscat.141c01f8768e2698c833e200a137b46faa. (59)
18:59:59.314123 IP 192.168.3.14.domain > 192.168.3.146.51531: 51206 TXT "df3a01f876f36139b20261ffff199bc5d2" (106)
19:00:00.318075 IP 192.168.3.146.51531 > 192.168.3.14.domain: 42562+ CNAME? dnscat.a9d001f87626f1d47d502700a204b9b29a. (59)
19:00:00.318985 IP 192.168.3.14.domain > 192.168.3.146.51531: 42562 CNAME dnscat.a46101f87629749bca3d3bffff199bc5d2. (114)
19:00:01.322982 IP 192.168.3.146.51531 > 192.168.3.14.domain: 31774+ CNAME? dnscat.463401f8760b6d62d2161500a3f4e0ace2. (59)
19:00:01.323834 IP 192.168.3.14.domain > 192.168.3.146.51531: 31774 CNAME dnscat.5f1801f87663de98899e88ffff199bc5d2. (114)
19:00:02.327962 IP 192.168.3.146.51531 > 192.168.3.14.domain: 63859+ CNAME? dnscat.9eb201f876a018f366547e00a4bc6fba04. (59)
19:00:02.328839 IP 192.168.3.14.domain > 192.168.3.146.51531: 63859 CNAME dnscat.930101f876ac73ddbaf0fcffff199bc5d2. (114)
19:00:03.332763 IP 192.168.3.146.51531 > 192.168.3.14.domain: 62398+ TXT? dnscat.7bac01f8764351af900cd900a5bc5ddb5e. (59)
19:00:03.333573 IP 192.168.3.14.domain > 192.168.3.146.51531: 62398 TXT "b9ce01f876d90c755936deffff199bc5d2" (106)
19:00:04.337516 IP 192.168.3.146.51531 > 192.168.3.14.domain: 55126+ CNAME? dnscat.812e01f876b58ca5082caf00a65297ec0f. (59)
19:00:04.338606 IP 192.168.3.14.domain > 192.168.3.146.51531: 55126 CNAME dnscat.3d6701f87698a399ef6d44ffff199bc5d2. (114)
19:00:05.342594 IP 192.168.3.146.51531 > 192.168.3.14.domain: 11506+ MX? dnscat.272701f87683553e0b1c9a00a7e15abc97. (59)
19:00:05.343461 IP 192.168.3.14.domain > 192.168.3.146.51531: 11506 MX dnscat.a9f101f8767d4c2005df91ffff199bc5d2. 10 (116)
19:00:06.347362 IP 192.168.3.146.51531 > 192.168.3.14.domain: 53538+ CNAME? dnscat.500401f876284412faf60800a84dbeb2f3. (59)
19:00:06.348297 IP 192.168.3.14.domain > 192.168.3.146.51531: 53538 CNAME dnscat.b91901f8765d59947226b5ffff199bc5d2. (114)
19:00:07.352255 IP 192.168.3.146.51531 > 192.168.3.14.domain: 33159+ MX? dnscat.52be01f87672ffe09e369b00a93fe52739. (59)
19:00:07.353209 IP 192.168.3.14.domain > 192.168.3.146.51531: 33159 MX dnscat.0dfd01f876cf693fcf5dbfffff199bc5d2. 10 (116)
19:00:08.357164 IP 192.168.3.146.51531 > 192.168.3.14.domain: 29702+ MX? dnscat.925e01f876dd083fff9fd900aabe558df9. (59)
19:00:08.358071 IP 192.168.3.14.domain > 192.168.3.146.51531: 29702 MX dnscat.814801f876eac55f496cffffff199bc5d2. 10 (116)
19:00:09.362018 IP 192.168.3.146.51531 > 192.168.3.14.domain: 4696+ MX? dnscat.70a501f8767e93eb1cd30900abe0eecc54. (59)
19:00:09.362871 IP 192.168.3.14.domain > 192.168.3.146.51531: 4696 MX dnscat.a32301f876abb71c607de8ffff199bc5d2. 10 (116)
19:00:10.366816 IP 192.168.3.146.51531 > 192.168.3.14.domain: 15700+ MX? dnscat.c3a001f876e74a16f60f9900ac93a7bbce. (59)
19:00:10.367998 IP 192.168.3.14.domain > 192.168.3.146.51531: 15700 MX dnscat.af1401f876188cd2db0e2effff199bc5d2. 10 (116)
19:00:11.371978 IP 192.168.3.146.51531 > 192.168.3.14.domain: 20014+ TXT? dnscat.06ef01f876955a7a8f3e9d00adc9294887. (59)
19:00:11.372796 IP 192.168.3.14.domain > 192.168.3.146.51531: 20014 TXT "112101f876051a1a605007ffff199bc5d2" (106)
19:00:12.376251 IP 192.168.3.146.51531 > 192.168.3.14.domain: 52950+ CNAME? dnscat.ea2b01f8762940297fcaa900ae6f52ca69. (59)
19:00:12.377131 IP 192.168.3.14.domain > 192.168.3.146.51531: 52950 CNAME dnscat.f65001f8766a51d9c4931affff199bc5d2. (114)
19:00:13.380931 IP 192.168.3.146.51531 > 192.168.3.14.domain: 64390+ MX? dnscat.c23101f8765db8633799ab00aff1d753f3. (59)
19:00:13.381790 IP 192.168.3.14.domain > 192.168.3.146.51531: 64390 MX dnscat.788501f876382d2885cefaffff199bc5d2. 10 (116)
19:00:14.385768 IP 192.168.3.146.51531 > 192.168.3.14.domain: 22717+ MX? dnscat.847c01f876cb292a8ba4f600b095f6e81c. (59)
19:00:14.386628 IP 192.168.3.14.domain > 192.168.3.146.51531: 22717 MX dnscat.7ddc01f87608d93eacf7a9ffff199bc5d2. 10 (116)
19:00:15.390419 IP 192.168.3.146.51531 > 192.168.3.14.domain: 5529+ TXT? dnscat.481501f876d22ee4a7657300b15470840e. (59)
19:00:15.391273 IP 192.168.3.14.domain > 192.168.3.146.51531: 5529 TXT "b7fb01f87659f7d18778b2ffff199bc5d2" (106)
19:00:16.394967 IP 192.168.3.146.51531 > 192.168.3.14.domain: 63178+ TXT? dnscat.1d4301f876fe6b1a0b120000b26442cd41. (59)
19:00:16.396588 IP 192.168.3.14.domain > 192.168.3.146.51531: 63178 TXT "102601f876fae59c200a14ffff199bc5d2" (106)
19:00:17.400645 IP 192.168.3.146.51531 > 192.168.3.14.domain: 62016+ CNAME? dnscat.5aad01f8761f302b866eec00b33f5a6cae. (59)
19:00:17.401593 IP 192.168.3.14.domain > 192.168.3.146.51531: 62016 CNAME dnscat.da9c01f8765ffdad4776eeffff199bc5d2. (114)
19:00:18.405703 IP 192.168.3.146.51531 > 192.168.3.14.domain: 17960+ TXT? dnscat.910001f876abd683996eb300b46552a86c. (59)
19:00:18.406565 IP 192.168.3.14.domain > 192.168.3.146.51531: 17960 TXT "c6c101f876ef7acee166aeffff199bc5d2" (106)
19:00:19.410552 IP 192.168.3.146.51531 > 192.168.3.14.domain: 38167+ CNAME? dnscat.22bd01f876e7e16d0e36ee00b566d7675b. (59)
19:00:19.411476 IP 192.168.3.14.domain > 192.168.3.146.51531: 38167 CNAME dnscat.ddd601f876240d643e9429ffff199bc5d2. (114)
19:00:20.415622 IP 192.168.3.146.51531 > 192.168.3.14.domain: 7479+ TXT? dnscat.867901f87696555eb315f900b62db436e4. (59)
19:00:20.416437 IP 192.168.3.14.domain > 192.168.3.146.51531: 7479 TXT "fd5c01f876d421d134b098ffff199bc5d2" (106)
19:00:21.420349 IP 192.168.3.146.51531 > 192.168.3.14.domain: 56315+ TXT? dnscat.59d101f876c7a60044b22f00b7ac2263ba. (59)
19:00:21.421190 IP 192.168.3.14.domain > 192.168.3.146.51531: 56315 TXT "691401f876752be5a1f480ffff199bc5d2" (106)
19:00:22.425297 IP 192.168.3.146.51531 > 192.168.3.14.domain: 37282+ CNAME? dnscat.def401f876226c1481a09300b899ed9e46. (59)
19:00:22.426158 IP 192.168.3.14.domain > 192.168.3.146.51531: 37282 CNAME dnscat.3c3101f876af69c3b5d699ffff199bc5d2. (114)
19:00:23.430129 IP 192.168.3.146.51531 > 192.168.3.14.domain: 15967+ TXT? dnscat.05b901f8768e502978c45d00b971bdf721. (59)
19:00:23.431270 IP 192.168.3.14.domain > 192.168.3.146.51531: 15967 TXT "48dd01f8762f837448b05affff199bc5d2" (106)
19:00:24.435448 IP 192.168.3.146.51531 > 192.168.3.14.domain: 19522+ TXT? dnscat.81e101f876070eab38626100ba66cc710d. (59)
19:00:24.436246 IP 192.168.3.14.domain > 192.168.3.146.51531: 19522 TXT "3ccc01f876221c716177d2ffff199bc5d2" (106)
19:00:25.440371 IP 192.168.3.146.51531 > 192.168.3.14.domain: 26147+ MX? dnscat.e0ed01f876a9b1ce19161400bb215b373f. (59)
19:00:25.441262 IP 192.168.3.14.domain > 192.168.3.146.51531: 26147 MX dnscat.a99d01f87687ce7a329cc5ffff199bc5d2. 10 (116)
19:00:26.445399 IP 192.168.3.146.51531 > 192.168.3.14.domain: 9354+ CNAME? dnscat.817501f8761e19af866d7200bc7be4073a. (59)
19:00:26.446240 IP 192.168.3.14.domain > 192.168.3.146.51531: 9354 CNAME dnscat.4b0501f876110aebadf771ffff199bc5d2. (114)
19:00:27.450409 IP 192.168.3.146.51531 > 192.168.3.14.domain: 27290+ TXT? dnscat.b91101f8769dc3cf0aff1800bd37a61283. (59)
19:00:27.451204 IP 192.168.3.14.domain > 192.168.3.146.51531: 27290 TXT "29d001f8768023b2e0e704ffff199bc5d2" (106)
19:00:28.455123 IP 192.168.3.146.51531 > 192.168.3.14.domain: 32834+ TXT? dnscat.790801f8765babc7838f7300be5512513f. (59)
19:00:28.455917 IP 192.168.3.14.domain > 192.168.3.146.51531: 32834 TXT "26d501f876c761e5bcef97ffff199bc5d2" (106)
19:00:29.459906 IP 192.168.3.146.51531 > 192.168.3.14.domain: 11084+ MX? dnscat.886f01f876ec9ce647d88300bf26656308. (59)
19:00:29.460754 IP 192.168.3.14.domain > 192.168.3.146.51531: 11084 MX dnscat.a5ae01f876e9485ba2ac64ffff199bc5d2. 10 (116)
19:00:30.464692 IP 192.168.3.146.51531 > 192.168.3.14.domain: 13247+ CNAME? dnscat.fb6301f876b874834b7c5300c0982e2288. (59)
19:00:30.465606 IP 192.168.3.14.domain > 192.168.3.146.51531: 13247 CNAME dnscat.59c701f8761c7c2c82b565ffff199bc5d2. (114)
19:00:31.469606 IP 192.168.3.146.51531 > 192.168.3.14.domain: 16348+ CNAME? dnscat.7bb501f876fc35e325d1bb00c15bb0f20a. (59)
19:00:31.470726 IP 192.168.3.14.domain > 192.168.3.146.51531: 16348 CNAME dnscat.82cf01f876ce0de0acd7f7ffff199bc5d2. (114)
19:00:32.474884 IP 192.168.3.146.51531 > 192.168.3.14.domain: 52161+ MX? dnscat.4f9701f876a91553ab8fa500c231594e27. (59)
19:00:32.475743 IP 192.168.3.14.domain > 192.168.3.146.51531: 52161 MX dnscat.9b0b01f8764ddbb50b3e11ffff199bc5d2. 10 (116)
19:00:33.479926 IP 192.168.3.146.51531 > 192.168.3.14.domain: 53474+ CNAME? dnscat.15bd01f876535da82b528900c3bf717896. (59)
19:00:33.480882 IP 192.168.3.14.domain > 192.168.3.146.51531: 53474 CNAME dnscat.035801f8764b2a3a5af6fcffff199bc5d2. (114)
19:00:34.485011 IP 192.168.3.146.51531 > 192.168.3.14.domain: 17149+ MX? dnscat.c9d201f8766cc7298daf0300c49ec83689. (59)
19:00:34.485924 IP 192.168.3.14.domain > 192.168.3.146.51531: 17149 MX dnscat.87ad01f876088c27f3caeaffff199bc5d2. 10 (116)
19:00:35.490116 IP 192.168.3.146.51531 > 192.168.3.14.domain: 63849+ TXT? dnscat.6d0601f876b228aa68f86e00c5c042447f. (59)
19:00:35.490980 IP 192.168.3.14.domain > 192.168.3.146.51531: 63849 TXT "321001f876cefccf8c62caffff199bc5d2" (106)
19:00:36.494934 IP 192.168.3.146.51531 > 192.168.3.14.domain: 8471+ TXT? dnscat.a68001f87625c10a5271e500c62e0a97cc. (59)
19:00:36.495797 IP 192.168.3.14.domain > 192.168.3.146.51531: 8471 TXT "fa2101f876a126f885ac36ffff199bc5d2" (106)
19:00:37.499933 IP 192.168.3.146.51531 > 192.168.3.14.domain: 35626+ CNAME? dnscat.c64401f8762fce3b3063d200c713ec1de6. (59)
19:00:37.500880 IP 192.168.3.14.domain > 192.168.3.146.51531: 35626 CNAME dnscat.252f01f87663fb9e6fe11fffff199bc5d2. (114)
19:00:38.504989 IP 192.168.3.146.51531 > 192.168.3.14.domain: 47401+ TXT? dnscat.9f0f01f876801026d41f2c00c813426671. (59)
19:00:38.506136 IP 192.168.3.14.domain > 192.168.3.146.51531: 47401 TXT "c45001f87674fe08705f53ffff199bc5d2" (106)
19:00:39.510262 IP 192.168.3.146.51531 > 192.168.3.14.domain: 7962+ MX? dnscat.c34101f876bd060a779a1400c98b2060cd. (59)
19:00:39.511131 IP 192.168.3.14.domain > 192.168.3.146.51531: 7962 MX dnscat.a14001f876fd8f21d3cbd6ffff199bc5d2. 10 (116)
19:00:40.515302 IP 192.168.3.146.51531 > 192.168.3.14.domain: 53079+ MX? dnscat.a37e01f876cb27b33ed48500cab02f1462. (59)
19:00:40.516218 IP 192.168.3.14.domain > 192.168.3.146.51531: 53079 MX dnscat.e60e01f876109c1f6fa955ffff199bc5d2. 10 (116)
19:00:41.520364 IP 192.168.3.146.51531 > 192.168.3.14.domain: 1843+ MX? dnscat.836801f87651c5dbe4546500cba47660c5. (59)
19:00:41.521325 IP 192.168.3.14.domain > 192.168.3.146.51531: 1843 MX dnscat.f12301f87646b64cbe41e7ffff199bc5d2. 10 (116)
19:00:42.525499 IP 192.168.3.146.51531 > 192.168.3.14.domain: 5341+ CNAME? dnscat.69ec01f87678354ef2dddd00cc75205763. (59)
19:00:42.526381 IP 192.168.3.14.domain > 192.168.3.146.51531: 5341 CNAME dnscat.b22401f876312d89a4df40ffff199bc5d2. (114)
19:00:43.530570 IP 192.168.3.146.51531 > 192.168.3.14.domain: 50987+ CNAME? dnscat.c13701f876512b2a5c80e700cd90e14338. (59)
19:00:43.531483 IP 192.168.3.14.domain > 192.168.3.146.51531: 50987 CNAME dnscat.6d7201f876b57f3a299cccffff199bc5d2. (114)
19:00:44.535651 IP 192.168.3.146.51531 > 192.168.3.14.domain: 6563+ CNAME? dnscat.4b7c01f8764f88b6d071cc00ce9cbe907b. (59)
19:00:44.536745 IP 192.168.3.14.domain > 192.168.3.146.51531: 6563 CNAME dnscat.13bb01f876d442f1ab214affff199bc5d2. (114)
19:00:45.540665 IP 192.168.3.146.51531 > 192.168.3.14.domain: 25858+ CNAME? dnscat.0d3601f876786e98a7ef7000cfbec20fd9. (59)
19:00:45.541552 IP 192.168.3.14.domain > 192.168.3.146.51531: 25858 CNAME dnscat.b16c01f8768350472bb2a7ffff199bc5d2. (114)
19:00:46.545569 IP 192.168.3.146.51531 > 192.168.3.14.domain: 48867+ CNAME? dnscat.ce7b01f876d4f3e237cecc00d0935b2ddf. (59)
19:00:46.546503 IP 192.168.3.14.domain > 192.168.3.146.51531: 48867 CNAME dnscat.68c701f87610e170b5d45cffff199bc5d2. (114)
19:00:47.550691 IP 192.168.3.146.51531 > 192.168.3.14.domain: 7695+ TXT? dnscat.2c8e01f8768265ee52fd9f00d148ca4938. (59)
19:00:47.551498 IP 192.168.3.14.domain > 192.168.3.146.51531: 7695 TXT "a01601f8761446be0a1d96ffff199bc5d2" (106)
19:00:48.555644 IP 192.168.3.146.51531 > 192.168.3.14.domain: 29894+ TXT? dnscat.021b01f8760890f57aa13500d2c0011aac. (59)
19:00:48.556503 IP 192.168.3.14.domain > 192.168.3.146.51531: 29894 TXT "4db501f8765c5a1adea2beffff199bc5d2" (106)
19:00:49.560480 IP 192.168.3.146.51531 > 192.168.3.14.domain: 2353+ CNAME? dnscat.602301f8763ecc999344da00d3a3d3bb34. (59)
19:00:49.561426 IP 192.168.3.14.domain > 192.168.3.146.51531: 2353 CNAME dnscat.1cc601f8765ae4a35e8dd5ffff199bc5d2. (114)
19:00:50.565399 IP 192.168.3.146.51531 > 192.168.3.14.domain: 28775+ MX? dnscat.e96301f8768d0e73667ba700d4dbc29927. (59)
19:00:50.566956 IP 192.168.3.14.domain > 192.168.3.146.51531: 28775 MX dnscat.694701f876eed1c9af52b2ffff199bc5d2. 10 (116)
19:00:51.571063 IP 192.168.3.146.51531 > 192.168.3.14.domain: 51102+ MX? dnscat.a45401f87662c17e98206500d55a92da7e. (59)
19:00:51.571912 IP 192.168.3.14.domain > 192.168.3.146.51531: 51102 MX dnscat.4bb801f8766f1bd9ed7f49ffff199bc5d2. 10 (116)
19:00:52.576100 IP 192.168.3.146.51531 > 192.168.3.14.domain: 60113+ CNAME? dnscat.6ac801f8765c960fff4e3e00d62d3ae0e2. (59)
19:00:52.577080 IP 192.168.3.14.domain > 192.168.3.146.51531: 60113 CNAME dnscat.2f4701f876a6711eb33571ffff199bc5d2. (114)
19:00:53.581052 IP 192.168.3.146.51531 > 192.168.3.14.domain: 27556+ MX? dnscat.1bb301f876742227dd2efd00d755d1d200. (59)
19:00:53.581909 IP 192.168.3.14.domain > 192.168.3.146.51531: 27556 MX dnscat.1ec501f876a525211c504bffff199bc5d2. 10 (116)
19:00:54.585893 IP 192.168.3.146.51531 > 192.168.3.14.domain: 34932+ TXT? dnscat.bccd01f87672316306467700d8d4ef341b. (59)
19:00:54.586763 IP 192.168.3.14.domain > 192.168.3.146.51531: 34932 TXT "3ddd01f876905d4da64d61ffff199bc5d2" (106)
19:00:55.590703 IP 192.168.3.146.51531 > 192.168.3.14.domain: 36229+ TXT? dnscat.cffa01f876901b4d8f8bcb00d9aad720a7. (59)
19:00:55.591591 IP 192.168.3.14.domain > 192.168.3.146.51531: 36229 TXT "351b01f8769bb3e1625d2dffff199bc5d2" (106)
